{
  "schema_version": "investment-research-mandate-v4",
  "watchlist": [
    {
      "symbol": "NVDA",
      "kind": "company",
      "benchmark": "QQQ",
      "sector_benchmark": "XLK"
    },
    {
      "symbol": "MU",
      "kind": "company",
      "benchmark": "QQQ",
      "sector_benchmark": "XLK"
    },
    {
      "symbol": "QQQ",
      "kind": "etf",
      "benchmark": "SPY",
      "sector_benchmark": "XLK"
    }
  ],
  "objective": "Research NVDA and MU over the next three months. Compare their valuation assumptions, demand drivers, and downside risks against QQQ. Explain what evidence would change each assessment.\nRegistered scope: NVDA and MU compared against QQQ, over 63 trading sessions (approximately three months). Research only. Explain demand drivers, explicit valuation assumptions, downside cases, and symbol-specific evidence that would change the assessment. Use deterministic scenario calculations when supported; distinguish assumptions from facts, fiscal periods from annual earnings, and dated ETF holdings from current holdings. Missing consensus is unknown. The registered universe, budgets and tools cannot be changed by the question.",
  "horizon_sessions": [
    63
  ],
  "currency": "USD",
  "perspective": "long_only_research",
  "mode": "live",
  "sources": [
    {
      "source_id": "sec-submissions-MU",
      "symbols": [
        "MU"
      ],
      "title": "sec-submissions-MU",
      "publisher": "SEC",
      "url": "https://data.sec.gov/submissions/CIK0000723125.json",
      "fixture_text": null,
      "kind": "company",
      "published_at": null,
      "available_at": null,
      "critical": false,
      "adapter": "document",
      "local_path": null,
      "sha256": null,
      "captured_at": null,
      "share_basis": "not_applicable",
      "feed": null,
      "series_id": null,
      "units": null,
      "data_end": null
    },
    {
      "source_id": "sec-facts-MU",
      "symbols": [
        "MU"
      ],
      "title": "sec-facts-MU",
      "publisher": "SEC",
      "url": "https://data.sec.gov/api/xbrl/companyfacts/CIK0000723125.json",
      "fixture_text": null,
      "kind": "company",
      "published_at": null,
      "available_at": null,
      "critical": true,
      "adapter": "document",
      "local_path": null,
      "sha256": null,
      "captured_at": null,
      "share_basis": "not_applicable",
      "feed": null,
      "series_id": null,
      "units": null,
      "data_end": null
    },
    {
      "source_id": "sec-submissions-NVDA",
      "symbols": [
        "NVDA"
      ],
      "title": "sec-submissions-NVDA",
      "publisher": "SEC",
      "url": "https://data.sec.gov/submissions/CIK0001045810.json",
      "fixture_text": null,
      "kind": "company",
      "published_at": null,
      "available_at": null,
      "critical": false,
      "adapter": "document",
      "local_path": null,
      "sha256": null,
      "captured_at": null,
      "share_basis": "not_applicable",
      "feed": null,
      "series_id": null,
      "units": null,
      "data_end": null
    },
    {
      "source_id": "sec-facts-NVDA",
      "symbols": [
        "NVDA"
      ],
      "title": "sec-facts-NVDA",
      "publisher": "SEC",
      "url": "https://data.sec.gov/api/xbrl/companyfacts/CIK0001045810.json",
      "fixture_text": null,
      "kind": "company",
      "published_at": null,
      "available_at": null,
      "critical": true,
      "adapter": "document",
      "local_path": null,
      "sha256": null,
      "captured_at": null,
      "share_basis": "not_applicable",
      "feed": null,
      "series_id": null,
      "units": null,
      "data_end": null
    },
    {
      "source_id": "price-QQQ",
      "symbols": [
        "QQQ"
      ],
      "title": "price-QQQ",
      "publisher": "Alpaca",
      "url": "https://data.alpaca.markets/v2/stocks/QQQ/bars?timeframe=1Day&start=2025-08-07T02%3A50%3A13.777209%2B00%3A00&end=2026-09-21T02%3A30%3A13.777209%2B00%3A00&limit=1000&adjustment=split&feed=sip&sort=asc",
      "fixture_text": null,
      "kind": "market",
      "published_at": null,
      "available_at": null,
      "critical": true,
      "adapter": "alpaca_daily",
      "local_path": null,
      "sha256": null,
      "captured_at": null,
      "share_basis": "split_adjusted",
      "feed": "sip",
      "series_id": null,
      "units": null,
      "data_end": null
    },
    {
      "source_id": "price-MU",
      "symbols": [
        "MU"
      ],
      "title": "price-MU",
      "publisher": "Alpaca",
      "url": "https://data.alpaca.markets/v2/stocks/MU/bars?timeframe=1Day&start=2025-08-07T02%3A50%3A13.777209%2B00%3A00&end=2026-09-21T02%3A30%3A13.777209%2B00%3A00&limit=1000&adjustment=split&feed=sip&sort=asc",
      "fixture_text": null,
      "kind": "market",
      "published_at": null,
      "available_at": null,
      "critical": true,
      "adapter": "alpaca_daily",
      "local_path": null,
      "sha256": null,
      "captured_at": null,
      "share_basis": "split_adjusted",
      "feed": "sip",
      "series_id": null,
      "units": null,
      "data_end": null
    },
    {
      "source_id": "price-NVDA",
      "symbols": [
        "NVDA"
      ],
      "title": "price-NVDA",
      "publisher": "Alpaca",
      "url": "https://data.alpaca.markets/v2/stocks/NVDA/bars?timeframe=1Day&start=2025-08-07T02%3A50%3A13.777209%2B00%3A00&end=2026-09-21T02%3A30%3A13.777209%2B00%3A00&limit=1000&adjustment=split&feed=sip&sort=asc",
      "fixture_text": null,
      "kind": "market",
      "published_at": null,
      "available_at": null,
      "critical": true,
      "adapter": "alpaca_daily",
      "local_path": null,
      "sha256": null,
      "captured_at": null,
      "share_basis": "split_adjusted",
      "feed": "sip",
      "series_id": null,
      "units": null,
      "data_end": null
    },
    {
      "source_id": "price-SPY",
      "symbols": [
        "SPY"
      ],
      "title": "price-SPY",
      "publisher": "Alpaca",
      "url": "https://data.alpaca.markets/v2/stocks/SPY/bars?timeframe=1Day&start=2025-08-07T02%3A50%3A13.777209%2B00%3A00&end=2026-09-21T02%3A30%3A13.777209%2B00%3A00&limit=1000&adjustment=split&feed=sip&sort=asc",
      "fixture_text": null,
      "kind": "market",
      "published_at": null,
      "available_at": null,
      "critical": false,
      "adapter": "alpaca_daily",
      "local_path": null,
      "sha256": null,
      "captured_at": null,
      "share_basis": "split_adjusted",
      "feed": "sip",
      "series_id": null,
      "units": null,
      "data_end": null
    },
    {
      "source_id": "price-XLK",
      "symbols": [
        "XLK"
      ],
      "title": "price-XLK",
      "publisher": "Alpaca",
      "url": "https://data.alpaca.markets/v2/stocks/XLK/bars?timeframe=1Day&start=2025-08-07T02%3A50%3A13.777209%2B00%3A00&end=2026-09-21T02%3A30%3A13.777209%2B00%3A00&limit=1000&adjustment=split&feed=sip&sort=asc",
      "fixture_text": null,
      "kind": "market",
      "published_at": null,
      "available_at": null,
      "critical": false,
      "adapter": "alpaca_daily",
      "local_path": null,
      "sha256": null,
      "captured_at": null,
      "share_basis": "split_adjusted",
      "feed": "sip",
      "series_id": null,
      "units": null,
      "data_end": null
    },
    {
      "source_id": "price-IWM",
      "symbols": [
        "IWM"
      ],
      "title": "price-IWM",
      "publisher": "Alpaca",
      "url": "https://data.alpaca.markets/v2/stocks/IWM/bars?timeframe=1Day&start=2025-08-07T02%3A50%3A13.777209%2B00%3A00&end=2026-09-21T02%3A30%3A13.777209%2B00%3A00&limit=1000&adjustment=split&feed=sip&sort=asc",
      "fixture_text": null,
      "kind": "market",
      "published_at": null,
      "available_at": null,
      "critical": false,
      "adapter": "alpaca_daily",
      "local_path": null,
      "sha256": null,
      "captured_at": null,
      "share_basis": "split_adjusted",
      "feed": "sip",
      "series_id": null,
      "units": null,
      "data_end": null
    },
    {
      "source_id": "price-HYG",
      "symbols": [
        "HYG"
      ],
      "title": "price-HYG",
      "publisher": "Alpaca",
      "url": "https://data.alpaca.markets/v2/stocks/HYG/bars?timeframe=1Day&start=2025-08-07T02%3A50%3A13.777209%2B00%3A00&end=2026-09-21T02%3A30%3A13.777209%2B00%3A00&limit=1000&adjustment=split&feed=sip&sort=asc",
      "fixture_text": null,
      "kind": "market",
      "published_at": null,
      "available_at": null,
      "critical": false,
      "adapter": "alpaca_daily",
      "local_path": null,
      "sha256": null,
      "captured_at": null,
      "share_basis": "split_adjusted",
      "feed": "sip",
      "series_id": null,
      "units": null,
      "data_end": null
    },
    {
      "source_id": "qqq-profile",
      "symbols": [
        "QQQ"
      ],
      "title": "qqq-profile",
      "publisher": "qqq-profile",
      "url": "https://www.invesco.com/qqq-etf/en/about.html",
      "fixture_text": null,
      "kind": "etf",
      "published_at": null,
      "available_at": null,
      "critical": false,
      "adapter": "etf_profile",
      "local_path": "datasets/workbench/manual-sources/qqq-profile-20260911.json",
      "sha256": "f3b7c3b88dd297828268e2285d92ba3fe9dbbdd0890c442b47bc117980254c67",
      "captured_at": "2026-09-15T19:12:06+00:00",
      "share_basis": "not_applicable",
      "feed": null,
      "series_id": null,
      "units": null,
      "data_end": null
    },
    {
      "source_id": "qqq-holdings",
      "symbols": [
        "QQQ"
      ],
      "title": "qqq-holdings",
      "publisher": "qqq-holdings",
      "url": "https://www.invesco.com/qqq-etf/en/about.html",
      "fixture_text": null,
      "kind": "etf",
      "published_at": null,
      "available_at": null,
      "critical": false,
      "adapter": "etf_holdings",
      "local_path": "datasets/workbench/manual-sources/qqq_holdings_2026-09-12.csv",